Q_ID,Question_Text,Domain,Tier,Intensity,Primary_Bucket,Deck_Eligible,Contraindications,Personas,Situations,Mechanisms,Performance_Tags,Relationship_Tags,Risk_Flags,Biological_Tags,Digital_Tags,Format_Tags,Other_Tags
Q-1042,What do you call 'productivity' that is actually avoidance?,D.VI_OUTPUT,B Deepen,I2.SCAN,Output,True,,P.FOUNDER,S.BURNOUT,M.AVOIDANCE_LOOP,PERF.BUSYWORK,,,,,F.COACHING_1ON1,SYM.PROCRASTINATION
Q-0089,"What is your caffeine/nicotine signature? (What are you using to force-regulate your nervous system, and what does it cost you later?)",D.I_HARDWARE,B Deepen,I2.SCAN,Hardware,True,,P.FOUNDER,S.BURNOUT,M.SOMATIC_DISREGULATION,,,,BIO.CAFFEINE_NICOTINE,,F.SOLO_JOURNAL,G.REGULATION
Q-2103,Where do you demand certainty that life cannot provide?,D.II_OS,C Mechanism,I3.DEEP,OS,True,,P.FOUNDER,S.STARTUP_VOLATILITY,M.CONTROL_STRATEGY,PERF.DECISION_FATIGUE,,,,,F.COACHING_1ON1,SYM.ANXIETY
Q-3011,What does your mind 'assume will happen' before most investor or high-stakes meetings?,D.II_OS,B Deepen,I2.SCAN,OS,True,,P.FOUNDER,S.PERFORMANCE_SLUMP,M.COG_DISTORTION,PERF.IMPOSTOR_PATTERN,,,,,F.COACHING_1ON1,G.CONFIDENCE
Q-4055,"If you stopped trying to 'win' at work, what emotion would you be forced to feel?",D.IV_SELF,C Mechanism,I3.DEEP,Self,True,Avoid if user is currently in an acute depressive episode; pace and provide grounding options.,P.FOUNDER,S.BURNOUT,M.IDENTITY_FUSION,,,,,,F.SOLO_JOURNAL,"SYM.NUMBNESS, G.MEANING"
